{
  "$schema": "http://json-schema.org/draft-07/schema#",
  "title": "Note",
  "description": "A note in the Life Engine canonical data model.",
  "type": "object",
  "required": ["id", "title", "body", "source", "source_id", "created_at", "updated_at"],
  "properties": {
    "id": {
      "type": "string",
      "description": "Unique identifier assigned by Core"
    },
    "title": {
      "type": "string",
      "description": "Note title"
    },
    "body": {
      "type": "string",
      "description": "Note content in markdown or plain text"
    },
    "tags": {
      "type": "array",
      "items": { "type": "string" },
      "description": "Tags for categorisation and search"
    },
    "source": {
      "type": "string",
      "description": "Identifier of the connector or plugin that produced this record"
    },
    "source_id": {
      "type": "string",
      "description": "The record's original ID in the source system"
    },
    "extensions": {
      "type": "object",
      "description": "Namespaced object for plugin-specific fields"
    },
    "created_at": {
      "type": "string",
      "format": "date-time",
      "description": "Record creation timestamp"
    },
    "updated_at": {
      "type": "string",
      "format": "date-time",
      "description": "Record last-updated timestamp"
    }
  },
  "additionalProperties": false
}
