{
  "id": "550e8400-e29b-41d4-a716-446655440002",
  "title": "Meeting notes \u2014 Architecture review",
  "body": "Discussed plugin sandboxing approach. Decided on Extism for WASM runtime.",
  "tags": [
    "meeting",
    "architecture"
  ],
  "source": "test",
  "source_id": "test-note-001",
  "extensions": {
    "com.obsidian.connector": {
      "vault": "work",
      "path": "meetings/arch-review.md"
    }
  },
  "created_at": "2026-01-15T10:30:00Z",
  "updated_at": "2026-01-15T10:30:00Z"
}
